User,Comment,Date,Comment_ID
DollarsandSense,Access exclusive first-hand updates and insights on Telegram 👉 http://t.me/dollarsandsense,22/Jun/19 Jun,2851763221560396
Nicky Teh,#4 after switching to the new retailer tue application was cancelled because the staff who did the registering messed up the application form,21/Jun/19 Jun,2849374891799229
Colin Lim,"Use this article, continue to support SP group.. Let OEMs all close down..",21/Jun/19 Jun,2849499098453475
Goh Choon Hian,I just dun understand! Why whole sale can be more expensive then retailers? Isnt that against market principles?,21/Jun/19 Jun,2848628641873854
Teo Vincent,U know what is call monopoly,21/Jun/19 Jun,2849268945143157
