,content
question,"AMA The Fifth Person Investments Asked by Terence TanAsked on 21 Feb 2019How much of your portfolio is in Overseas counters? For me, mine is about 15% to 20%.?3 answersAnswerBump1"
0,Answers (3)Sort By Most UpvoteMost UpvoteMost Recent
1,"Victor Chng, Co-Founder at Fifth Person Pte LtdLevel 4. ProdigyUpdated on 07 Jun 2019Hi,I have about 50% of the portfolio in overseas companies.1 comment1"
2,Terence Tan22 Feb 2019Are they all from different countries?
3,"Jonathan Chia Guangrong, Fund Manager at JCG FundLevel 6. MasterUpdated on 07 Jun 2019About 75% are focused in my options portfolio in the US. Rest are mostly in reits here, with a small portion in private equity 5 comments1"
4,See all 5 comments Jonathan Chia Guangrong22 Feb 2019No right or wrong. As long as you are comfortable with the returns and risk aspect of your investments. Terence Tan25 Feb 2019True! Congrats!
5,"Gabriel Tham, Kenichi Tag Team Member at Tag TeamLevel 8. WizardUpdated on 07 Jun 2019My overseas counters are index ETFs, counted or not? I think my allocation is about 30-40%. 3 comments1"
6,"See all 3 comments Gabriel Tham21 Feb 2019Vanguard world index etf, ishares world bond etfTerence Tan22 Feb 2019Ic. Thanks for informing. I prefer to select individual companies. "
