,content
question,"Bonds CPF SeedlyTV EP06 Investments Asked by AnonymousAsked on 30 May 2019Most investment strategies involve a portion of bonds or fixed income. In the Singaporean context, is the CPF a viable substitute?Our CPF accounts seem to double up for many roles in the a regular Singaporean's life. Do you all think it is a viable substitute as bonds/fixed income for investing? I'm planning to make some investments soon.3 answersAnswerBump1"
0,Answers (3)Sort By Most UpvoteMost UpvoteMost Recent
1,"Kenneth LouLevel 8. WizardAnswered on 04 Jun 2019Gonna quote a line in what Alan shared:""Whatever the case may be, when I turn 55, there is no way of knowing if equities would be in a rough patch or not.So, having some money in investment grade bonds makes sense to me.It gives me peace of mind.The CPF is as good as a AAA rated sovereign bond and it is one that pays relatively attractive ""coupons"".""0 comments1"
2,Alan KorLevel 5. GeniusAnswered on 04 Jun 2019http://singaporeanstocksinvestor.blogspot.com/2018/01/8-years-aaa-bond-with-25-and-4-coupons.html0 comments0
3,"Hariz Arthur Maloy, Independent Financial Advisor at Promiseland IndependentTop Contributor (Sep)Level 9. God of WisdomAnswered on 30 May 2019It's a personal preference. I wouldn't. It's hard to rebalance when CPF is your fixed income portion of a portfolio. I'll still invest in fixed income using cash and allocate it in my portfolio accordingly.0 comments0"
