,content
question,"Brokerages DBS Vickers Securities Stocks Investments DBS Asked by AnonymousAsked on 01 Jun 2019Will the DBS Vickers Cash Upfront Account only hold your stock for 3 days?For DBS Cash Upfront brokerage users: is it true when making a trade with the DBS Vickers Cash Upfront account, it will only hold your stock for 3 days before transferring to the CDP account?2 answersAnswerBump1"
0,Answers (2)Sort By Most UpvoteMost UpvoteMost Recent
1,"Ericsson TingLevel 3. WonderkidAnswered on 02 Jun 2019Hi yes,dbs cash upfront is custodian account hence the cheaper fees compare to dbs cash account. it is unlikely to sell the stock in 3 day unlless you are trading,in which case may i suggest that you look into fsmone or standard charter brokerage?0 comments1"
2,"Gabriel Tham, Kenichi Tag Team Member at Tag TeamLevel 8. WizardUpdated on 07 Jun 2019This applies to all brokerage. The rule is T+2 settlement.When you buy shares, the shares will be settled on T+2 where T is the day your order was filled. Then the shares will be deposited to CDP.3 comments1"
3,"See all 3 comments Gabriel Tham02 Jun 2019Well if u sell before going to CDP, u get back the net amount (sold price - purchase price). If a profit, u get credited then if lose u get money deducted from account)Question Poster02 Jun 2019Thanks gabriel"
