,content
question,"Career General Asked by AnonymousAsked on 10 May 2019how much to setup online e-commerce website?I have an idea to do online business, and wonder if anyone knows how much it may typically cost to get a website setup from scratch with payment gateway?3 answersAnswerBump0"
0,Answers (3)Sort By Most UpvoteMost UpvoteMost Recent
1,"Clarence Chua, Financial Planning Specialist at Prudential Assurance SingaporeTop Contributor (Sep)Level 7. Grand MasterAnswered on 11 May 2019If this is your product first entry to the market, try out apps like carousell etc first. You can even try out with facebook page and use a third party vendor for payment gateway (e.g. paypal)Get a guide on the market response before launching a website.
You can use a hosting server such as bluehost to launch your own website etc, if you are able to design your own website, the cost will be low (less than 300 usd) to set it up.Alternatively, you can also use Amazon as a platform0 comments2"
2,"Kenneth Lou, Co-founder at SeedlyLevel 8. WizardAnswered on 11 May 2019I'd recommend first testing the market with Carousell or Shopee first?I've seen many interesting businesses which start there.I feel that building up a website from scratch may need more time and effort and money, which should be the next step after validating the market first :)If you are keen, then you can use either:Strikingly Wix0 comments0"
3,"William NgLevel 2. RookieAnswered on 11 May 2019It’s depends on your budget. I once started with Shopify, it’s user friendly and with payment gateway. Perhaps you want to take a look.0 comments0"
