,content
question,"Credit Card Asked by AnonymousAsked on 20 Mar 2019How can I get credit card approval?I started a full time job last december with a 30k P.A salary, applied for Citibank CC at IT show couple of weeks back then cus the bank guy told me I could; I got rejection letter from them couple days back. Is there anyway to find out the reason or something I can do to get an approval?3 answersAnswerBump0"
0,Answers (3)Sort By Most UpvoteMost UpvoteMost Recent
1,"Patrick WeeLevel 2. RookieAnswered on 21 Mar 2019Assume your last December is 2018. You can't get a credit card as u will need at least 3 to 6 mths payslip.
U can try after 6 mths or from what I feel, dbs and scb are more readily to give a cc for those starting out at work0 comments0"
2,"Gabriel Tham, Kenichi Tag Team Member at Tag TeamLevel 8. WizardUpdated on 07 Jun 201930k annual salary should be enough to meet the credit card application. Did you send them the correct documents? Payslip, a bill with address or income tax slipWhat you can do is sign up for it again. No harm sending in another application.1 comment0"
3,"Question Poster21 Mar 2019Will try again, went to Standard charter to apply for the cashback card and was told that it could be cus I have no credit history so harder to get approval. Thanks!"
4,"Han Jinyuan Larry, Senior Lifeguard at CertisLevel 3. WonderkidUpdated on 07 Jun 2019Citibank will send you 1 letter which you can check with Credit Bureau Singapore on your Credit Report.1 comment0"
5,"Question Poster21 Mar 2019My credit score is GX, was told that it could be the reason"
