,content
question,Credit Card UOB Asked by AnonymousAsked on 28 Jul 2019Does UOB Krisflyer Credit Card award bonus miles for GrabPay top-ups?Hi all. I'm an active Grab user and am currently syncing my UOB KrisFlyer Credit Card to my GrabPay. Wondering if there're any extra bonus miles for doing so. Anyone in the same position with any experience to share?2 answersAnswerBump3
0,Answers (2)Sort By Most UpvoteMost UpvoteMost Recent
1,"Javier Lim, Financial Consultant at Prudential Assurance Company SingaporeLevel 5. GeniusAnswered on 28 Jul 2019It really depends, So far UOB has been awarding me miles for Grab transactions.https://www.uob.com.sg/assets/pdfs/kf_credit_card_full_tnc.pdf?s_cid=pfs:sg:paid:sea:go:na:tx:na:001506:240419-evergreen:na:cvp_gift:pc-go&vid=pc-goQuoted from the T&CKrisFlyer miles will not be awarded for NETS and NETS-related transactions, 0% Installment Payment Plans, SmartPay, personal loan, balance/funds transfers, cash advances, fees, interests, finance charges, late payment charges, annual fee charges, reversals, transactions relating to top-ups of any pre-paid card and brokerage / securities, any gambling related transactions, any trading transactions (including but not limited to websites for trading of shares and cryptocurrency), other financial charges and any other transactions we may exclude from time to time without prior notice.0 comments4"
2,"Clarence Chua, Financial Planning Specialist at Prudential Assurance SingaporeTop Contributor (Sep)Level 7. Grand MasterAnswered on 28 Jul 2019On direct grab transactions, I believe it does.
However for miles card, top-ups normally do not get rewarded.
E.g topping up of cash card, ez-link card etc0 comments3"
