,content
question,Dividends Investments Asked by AnonymousAsked on 05 Apr 2019Are high dividend stocks a good investment ?6 answersAnswerBump3
0,Answers (6)Sort By Most UpvoteMost UpvoteMost Recent
1,"Isaac Chan, Business  at NUSLevel 8. WizardUpdated on 09 Apr 2019On top of what the others have mentioned, I can introduce 2 metrics that might be helpful, which is Dividend Payout Ratio and dividends as a percentage of free cashflow.Dividend Payout RatioDividend payout ratio is simply the percentage of net profits that are being paid out to shareholders. To find this simply take dividends paid out divided by net profit as shown. The lower the figure, the better, since this means that the company isn't taking out too much of its net profits for dividend payments, and the dividends can sustain.Dividends as Percentage of Free CashflowFCF measures cashflow that is availible to lenders and shareholders after the cash needs of the business have all been settled. This is a powerful measure since it looks at what kind of cash remains for non-business operating activities.The formula shows how to get FCF. To get the percentage yield, just take the dividends divided by the FCF. Again, the lower the percentage the better.0 comments5"
2,"Billy Ko, President - Investment Club at Singapore Institute Of TechnologyLevel 6. MasterAnswered on 06 Apr 2019A high dividend yielding stock might look enticing but one has to dive in deeper to analyse the financials of the company. Is the dividend payout taking up a large percentage of their revenue / profits, are they generating positive cash flow. What are their strategies moving forward. Rickermers Maritime listed on SGX is one good example of a high dividend stock that went from Hero to Zero. At a price of USD0.26, it paid out USD0.024 worth of dividends consistently for 4 years. Alas, their cash position simply couldn't sustain the payouts, orderbooks were blank and they had to resort to filing for bankruptcy, with the company eventually winding up. Thus it is important to do one's due diligence in purchasing high dividend yielding stocks. If you can see the high dividend yield, other investors can too. But why aren't they jumping onto the bandwagon to push up the price? There comes your investigative skills to uncover this.0 comments2"
3,"Richard Woon Tian JunLevel 6. MasterAnswered on 06 Apr 2019Not necessarily. Just look at the Telco industry, they are getting beaten down on all fronts - stock price because of loss of investor confidence and profit margins because of increasing competition. Yet they still try to offer extremely attractive dividends eg. Starhub with a forward dividend yield of 10.53%. To put that in perspective, REITS, a form of trust that has to payout 90% of their income to unit holders, have a dividend yield of about 5~8%. I think when it comes down to it, business survival is the most important. Sometimes, a dividend cut may be painful in the short term, but if it can ensure that the firm has money retained earnings for reinvestment and payment of debt, I think as an investor I would rather have 1~2% lesser dividends for a few years if it didn't mean that the entire stock price would drop 20% if it didn't cut dividends.0 comments2"
4,"Zann ChuaLevel 6. MasterAnswered on 06 Apr 2019Hello! many people have the misconception that high dividend stocks is always good. However, this may not be the case. This is because a dividend is a percentage of a business's profit that it pays to their shareholders in the form of cash. When money is paid out as dividend is not being reinvested into the business. Thus, if a business is paying too high a percentage of its profits, it could be a sign that it has little room to grow by reinvesting its business and thus the company is unlikely to have any upside.
​0 comments1"
5,William HershawLevel 1. FreshieAnswered on 06 Apr 2019Yes. As part of a well diversified portfolio.. But in retirement should be alongside a broader market etf in drawdown.0 comments0
6,"Jonathan Chia Guangrong, Fund Manager at JCG FundLevel 6. MasterUpdated on 06 Apr 2019High yielding dividend stocks may not be a good thing, as there may be higher risk involved. Case in point, look at Asian Pay Television Trust. The dividend yield  was quite high before it got cut and the stock price suffered a lot as well. Consider looking at stocks with stable or even increasing dividends. The latter will be more common in the US0 comments0"
