,content
question,Expenses Tracking Insurance General Asked by AnonymousAsked on 15 May 2019What is considered as an expense? Does paying insurance consider as an expenses or an investment?4 answersAnswerBump0
0,Answers (4)Sort By Most UpvoteMost UpvoteMost Recent
1,"Clarence Chua, Financial Planning Specialist at Prudential Assurance SingaporeTop Contributor (Sep)Level 7. Grand MasterAnswered on 16 May 2019It varies from person to person.
I advise my client to place Insurance meant for coverage under expensesWhile Endowments or Investment plans can be under the respective categories accordingly0 comments2"
2,"Hariz Arthur Maloy, Independent Financial Advisor at Promiseland IndependentTop Contributor (Sep)Level 9. God of WisdomAnswered on 16 May 2019Policies with no cash value are expenses. Policies with cash values are assets/investments.0 comments1"
3,"Vincent Tan Wen Bin, Assistant Vice President at Thinkers AllianceLevel 5. GeniusAnswered on 22 May 2019If you think about what Robert Kiyosaki says; Assets put cash into your pocket, Liabilities take cash out of your pocket. I would have to say insurance that does not have cash value would be consider as expenses and those that hold value such as endowment would be considered as savings/investments.0 comments0"
4,"Gabriel Tham, Kenichi Tag Team Member at Tag TeamLevel 8. WizardAnswered on 17 May 2019Most insurance is expense. But if the insurance has a savings or investment portion, that is considered savings or investment.As long as money goes out and does not generate value, its expense.0 comments0"
