,content
question,"Family Asked by AnonymousAsked on 12 Aug 2019Should I pack angbao for SO’s grandparent birthday?This is the first time I’m visiting my SO’s family (grandparent’s birthday celebration). I was thinking of packing an angbao, should I do that? Is it okay? How much should I pack? Appreciate your advice! Only just started working this year3 answersAnswerBump0"
0,Answers (3)Sort By Most UpvoteMost UpvoteMost Recent
1,"Junus EuTop Contributor (Sep)Level 8. WizardAnswered on 14 Aug 2019Yes, or maybe something health related eg. a hamper from Eu Yan Sang? It is well packaged, and also practical.0 comments3"
2,"Gabriel Tham, Tag Team Member at Kenichi Tag TeamLevel 8. WizardAnswered on 14 Aug 2019Maybe auspicious number is good like 88? Haha also not too sure.0 comments1"
3,"Ck ChaiLevel 4. ProdigyUpdated on 15 Aug 2019I would think that it will be a nice gesture and it helps to give a good impression to the family.  Ang bao with auspicious no. like $88 should be good enough. Or like what Junus suggested, health / wellness hamper or even longevity buns hamper if the grandparent is 70 yrs old and above?0 comments0"
