,content
question,General Insurance Investments Asked by AnonymousAsked on 26 Sep 2018Are capital gains from forex trading taxable as income if i hold a free-lance position? (eg. an insurance agent)3 answersAnswerBump0
0,Answers (3)Sort By Most UpvoteMost UpvoteMost Recent
1,"DeleteEditGabriel Tham, Tag Team Member at Kenichi Tag TeamLevel 8. WizardAnswered on 26 Sep 2018Can be taxable or non-taxable.​It will depend if you choose to declare or not.​Why people declare forex profit? If they are full time trader and want to buy HDB or house, they need income statement. So, must declare forex profit as income to be able to take loan for house.​​0 comments1"
2,"Kenichi Xi, nᴉʍ oʇ dǝnᴉʇsǝd 不能说的秘密 at Tag Team with Gabriel ThamLevel 6. MasterAnswered on 27 Sep 2018Usually Forex Trading are from Oversea Broker,​Generally, overseas income received in Singapore on or after 1 Jan 2004 is not taxable and does not need to be declared. This includes overseas income paid into a Singapore bank account.​Local Broker, you do not have to pay any taxes on capital appreciation gains or dividend income.
​
Hope my reply helps.If you feel this reply have Quality, please upvote and check other Quality Reply.https://seedly.sg/profile/a-kenichi-xiThank you.0 comments0"
3,"Jonathan Chia Guangrong, Fund Manager at JCG FundLevel 6. MasterAnswered on 27 Sep 2018Technically capital gains are not taxable. But best to check with iras directly 0 comments0"
