,content
question,Insurance General Investments Asked by AnonymousAsked on 24 Oct 2018Would you ever consider buying Precious Metals? Why or why not?3 answersAnswerBump0
0,Answers (3)Sort By Most UpvoteMost UpvoteMost Recent
1,"Lok Yang TengLevel 6. MasterUpdated on 07 Jun 2019Price of precious metals is inversely related to performance of stock market. Since the ongoing(?) bull market from 2009, prices of precious metals(gold) havent been doing so well. If the market turns bearish, prices of gold, etc will probably increase too. On the other hand, you can consider buying precious metals to diversify your portfolio (there are Gold ETFs too).2 comments1"
2,"Question Poster28 Oct 2018Is GLD ETF, certificates and stuff better or physical Gold?Lok Yang Teng28 Oct 2018When buying physical gold, there are different types, bullion or commemorative coins (excluding gold plated). Commemorative coins usually appreciate in value (depending on supply and demand) + value of the gold itself. Downside is that you have to find somewhere safe to keep it and will incur deposit fees. Bullion are usually bought from banks and kept there, while the bank will issue a certificate (an IOU). 
Gold ETF enables dollar cost averaging over long term and disperses the risk more a... (more)"
3,"Good Day Every DayLevel 6. MasterAnswered on 30 Oct 2018I would not buy precious metals in the current market situation. Precious metals like gold and silver don't distribute dividends. Moreover, with a strong US dollar, it may not be a good time to buy gold and silver yet.0 comments0"
4,"Nick MuirLevel 1. FreshieAnswered on 30 Oct 2018As the saying goes, if you can't hold it you don't own it.0 comments0"
