,content
question,Investments Asked by AnonymousAsked on 22 Jul 2019What do you guys think of the Allianz income and growth CI AM DIS H2-SGD fund?Been researching into the Allianz income fund lately. Anyone with prior experience to share before I dabble in it?3 answersAnswerBump0
0,Answers (3)Sort By Most UpvoteMost UpvoteMost Recent
1,"Hariz Arthur Maloy, Independent Financial Advisor at Promiseland IndependentTop Contributor (Sep)Level 9. God of WisdomUpdated on 22 Jul 2019https://seedly.sg/questions/hi-considering-investing-in-allianz-income-and-growth-cl-am-dis-h2-sgd-any-feedback-on-these
I've answered this exact question here.2 comments2"
2,"Question Poster22 Jul 2019Thanks . Any other funds that you recommend ?Hariz Arthur Maloy22 Jul 2019Haha you'd have to be a client of mine. I don't even know what you're looking for, for me to recommend anything."
3,Alan KorLevel 5. GeniusAnswered on 23 Jul 2019Fund return is not the same as shareholder/policyholder returndo take note when pple with conflicting interest tries to entice you by using the fund returns0 comments0
4,"Harvey TanLevel 5. GeniusAnswered on 22 Jul 2019If you are buying for yield, i guess thats fine since the distribution yield is considered 'high' relatively speaking of couse.
But note that the source of the yield is mostly coming from the non-investment grade bond alloction of the portfolio which pretty much explained why the distribution yield is relatively highif you are looking for growth, look elsewhere.0 comments0"
