,content
question,"Investments ETF Asked by AnonymousAsked on 13 May 2019Do you have to pay/report taxes for dividends or income you received as a result of selling? More specifically, for those ETF plans which are purchase through banks?2 answersAnswerBump2"
0,Answers (2)Sort By Most UpvoteMost UpvoteMost Recent
1,"Clarence Chua, Financial Planning Specialist at Prudential Assurance SingaporeTop Contributor (Sep)Level 7. Grand MasterAnswered on 14 May 2019As mentioned by Gabriel. Singapore do not tax capital gains.However if such capitals gains are able to be classified as income, then they are taxable. You may refer to an article here https://www.straitstimes.com/singapore/courts-crime/couple-to-pay-tax-on-16m-profit-from-selling-bungalows Show lessFor dividendsGenerally, the following dividends are not taxable:a) Dividends paid on or after 1 Jan 2008 by a Singapore resident company under the one-tier corporate tax system except co-operatives;b) Foreign dividends received in Singapore on or after 1 Jan 2004 by resident individuals. If an individual resident in Singapore receives foreign-sourced dividends through a partnership in Singapore, these dividends may be exempt from Singapore tax if certain conditions are met. For details, please refer to Tax Exemption for Foreign-Sourced Income;c) Income distribution from Real Estate Investment Trusts (REITs), except distributions derived by individuals through a partnership in Singapore, or from the carrying on of a trade, business or profession in REITs.Read more about it here:
https://www.iras.gov.sg/irashome/Individuals/Locals/Learning-the-basics/Individuals-Required-to-Pay-Income-Tax/Taxes-on-Investments-in-Singapore/0 comments3"
2,"Gabriel Tham, Kenichi Tag Team Member at Tag TeamLevel 8. WizardAnswered on 13 May 2019No need. Singapore does not tax dividends or capital gains.0 comments1"
