,content
question,"Investments Property Savings Asked by AnonymousAsked on 29 Nov 2018I have not saved much ever since graduating and have mostly been living paycheck to paycheck. Any savings tips to be able to finance the cash downpayment of the HDB?I'm 33 now, single, and looking to buy a place of my own soon, preferably a 4 or 5 room HDB. I'm know I'm very late on the bandwagon, but I've resolved to try spending less and start saving to fund this goal. Monthly salary is about 8k and about 90k in CPF OA.3 answersAnswerBump0"
0,Answers (3)Sort By Most UpvoteMost UpvoteMost Recent
1,"Junus EuTop Contributor (Sep)Level 8. WizardAnswered on 05 Jun 2019If you are earning 8k monthly, there definitely is alot of room for saving, instead of living paycheck to paycheck. Coming from a place where I bought my first property at 26, I actually made sure to save at least S$4k a month years prior to that. My goal was actually to be able to purchase at 25, but I only actioned on it at 26. I was actually also frugal from Day One -- and actually given that I was working long hours, I was largely eating my breakfast, lunch and sometimes dinner in the office (provided for). That was one of the big savings I had. If I had to eat outside, I would usually keep my cost per meal to $5-7 in the CBD area. Apart from that, I also made sure to have a few sets of quality clothing for work, and not buy any additional pieces unless it required replacement. Same for shoes, I chose quality ones that could last over time, as opposed to the $50 types that I personally find spoil in less than a year. On the entertainment front, I also limited spending on that. Unless I was spending quality time with loved one, I generally would refrain from entertainment expenses when my peers were going to Zouk to club, or to fancy high-tea places on weekends. Lastly, it helped that I had the goal from my early 20s to be able to save enough to purchase property without the down payment taking up all of my savings, because I still wanted to be invested in other assets, and also have free cash. Having that goal in mind really helped to focus my efforts.0 comments2"
2,"Heng Kai Le, Mondomover at School Of LifeLevel 4. ProdigyAnswered on 09 Jun 20191) good to start with the end in mind ;) use positive visualisation to fuel your excitement and steel your will in regards to how fulfilling having your own house will feel. This will make saving fun2) think carefully about which part of the island you want to live in and use PropertyGuru to check out the prices of typical flats. I was born and raised in AMK and would have loved To continue living there, but alas! The prices here too expensive for me3) set a Budget. i wanted a 4-room flat, was comfortable with paying a maximum of $400k and eventually ended up in Yishun (prices here cheaper than flats in AMK)4) divide downpayment by 24 months = monthly saving goal. be very clear about how much you need to save in order to reach your goal5) be kind to yourself. Steps 1-4 will sap a lot of mental and emotional energy from you, so when you have your monthly saving goal, you can then plan as to how you can increase your income and/or reduce your expenses hope you are on your way to owning your house! Life eventually works out more often than not 💪🏽0 comments1"
3,"Hariz Arthur Maloy, Independent Financial Advisor at Promiseland IndependentTop Contributor (Sep)Level 9. God of WisdomAnswered on 29 Nov 2018Budget, track, evaluate.Only you can decide if you're spending too much, if you're comfortable with it, and how off you are with your targets. If you don't plan and track, you won't see progress. No progress and you also will lose motivation to keep saving. 0 comments0"
