,content
question,"Investments Robo-Advisors ETF Bonds Asked by AnonymousAsked on 17 Jun 2019Is money used for investment income tax exempted? I'm Self Employed, and using quite a significant part of my earnings in Robo Advisor, ETF & Bonds.Wondering if any of my money used in this Investment is Income Tax exempted.4 answersAnswerBump5"
0,Answers (4)Sort By Most UpvoteMost UpvoteMost Recent
1,"Elijah LeeTop Contributor (Sep)Level 9. God of WisdomUpdated on 17 Jun 2019If you are investing on a personal basis, any capital gains are not taxable. You need not report such gains in your tax returns.2 comments6"
2,"Question Poster17 Jun 2019Thanks for your help! What I meant was, let's say I earn 30k in 2019, & I use 10k for investments, Do I need to pay income tax for the 10k? I know it sounds absurd and sorry if its a dumb question.Elijah Lee17 Jun 2019Income tax is based on the income you earn, so yes, your assessable income would be considered 30K"
3,"Clarence Chua, Financial Planning Specialist at Prudential Assurance SingaporeTop Contributor (Sep)Level 7. Grand MasterAnswered on 18 Jun 2019If you are asking if your invested money are tax exempted or not. The answer will be they are not.If you are asking about if the money you earned are taxable or not then it depends.
Capital gains are not taxable in singapore. Income from dividends, shares, etc are taxable too.You may read more about it here https://www.iras.gov.sg/irashome/Individuals/Locals/Learning-the-basics/Individuals-Required-to-Pay-Income-Tax/Taxes-on-Investments-in-Singapore/P.S. While capital gains are generally not taxable, the Inland Revenue Authority of Singapore (Iras) will also determine if the sellers are in fact trading in properties/shares by considering factors such as frequency of transactions and the holding period of the properties/shares.You may read a news article related herehttps://www.straitstimes.com/singapore/courts-crime/couple-to-pay-tax-on-16m-profit-from-selling-bungalows0 comments2"
4,"Vincent Tan Wen Bin, Assistant Vice President at Thinkers AllianceLevel 5. GeniusAnswered on 18 Jun 2019If I understand your question correctly, what you are referring is that
Example: you earn $100k if you invest $10k, will your taxable income be $100k or $90k.Answer: $100k taxable income.
Investments are not allowable business expense. You can read up more here. https://www.iras.gov.sg/irashome/Businesses/Self-Employed/Working-out-your-taxes/Deductions-to-Save-Tax/Business-Expenses/If you would like to get tax exemptions, Contribute to your CPFSA contributionSRS contribution0 comments0"
5,"Gabriel Tham, Tag Team Member at Kenichi Tag TeamLevel 8. WizardUpdated on 17 Jun 2019Investing does not tax exempt you.Tax is calculated on earned salary/income. There is no tax relief or exemption for any investments made using your income. This also means any profits or dividends are not taxable as income.2 comments0"
6,Question Poster17 Jun 2019Awesome thanks for clarifying!Gabriel Tham17 Jun 2019This is so helpful 👍
