,content
question,"Investments Dividends Asked by AnonymousAsked on 05 May 2019If the dividend payment date is 15/05 and I buy the stock on 14/05, will I be eligible for the dividend payout?2 answersAnswerBump1"
0,Answers (2)Sort By Most UpvoteMost UpvoteMost Recent
1,"Gabriel Tham, Kenichi Tag Team Member at Tag TeamLevel 8. WizardAnswered on 06 May 2019Buy and own the stock before it goes XD or ex-dividendOnce it goes to XD or ex-dividend, it means they will start to record who are the owners eligible for the dividend. Then these owners will get the dividend on the dividend payout date.0 comments1"
2,Yong Kah HweeLevel 6. MasterUpdated on 07 Jun 2019Nope. You'll have to have the stock before the ex-dividend date.1 comment1
3,Ching Li Chew06 May 2019What does ex-dividend date mean pls?
