,content
question,Investments Asked by AnonymousAsked on 21 Aug 2018What other blogs or Youtube Channels do you recommend for beginners to learn Fundamental Analysis?2 answersAnswerBump0
0,Answers (2)Sort By Most UpvoteMost UpvoteMost Recent
1,"Good Day Every DayLevel 6. MasterAnswered on 15 Sep 2018https://fifthperson.com
Fifth Person0 comments0"
2,"Gabriel Tham, Tag Team Member at Kenichi Tag TeamLevel 8. WizardAnswered on 15 Sep 2018I personally like to listen/watchInvestor's podcasthttps://www.youtube.com/playlist?list=PLY2iemXCSz6FUEzsiSf4IZC244w--lR7n​0 comments0"
