,content
question,"Investments Asked by Linda TanAsked on 28 Mar 2019How would you allocate $10,000 of your investments?2 answersAnswerBump1"
0,Answers (2)Sort By Most UpvoteMost UpvoteMost Recent
1,"Hariz Arthur Maloy, Independent Financial Advisor at Promiseland IndependentTop Contributor (Sep)Level 9. God of WisdomUpdated on 07 Jun 201975% Equity 25% BondIn the equity portion:Quite even between the different geographies with a little more weighted in Asia right now. For the bonds, mainly investment grade SG bonds, and some global high yield corp bonds.Globally diversified, matching my risk profile, and I'll adjust the bond portion up 5% every 5 years, rebalanced quarterly. Expected portfolio return in the long run, 6-8+% returns p.a.1 comment3"
2,Linda Tan28 Mar 2019Thank you for sharing
3,"Jonathan Chia Guangrong, Fund Manager at JCG FundLevel 6. MasterAnswered on 28 Mar 2019Channel into my offshore brokerage to manage my options portfolio for 60% returns pa.0 comments1"
