,content
question,"Investments Asked by James LimAsked on 28 Oct 2018Question regarding Temasek 2.7% bond dividend issue?Hi, two questions for those who invested in the recent Temasek 2.7% bond. 1) Does anyone know when will the first coupon payout be? 2) Also, is it possible to change the bank account where the dividends will be credited from cdp's website, and are there any additional charges for doing so? Thank you!2 answersAnswerBump1"
0,Answers (2)Sort By Most UpvoteMost UpvoteMost Recent
1,Von TanLevel 1. FreshieUpdated on 07 Jun 2019Hi currently the bond is trading at 1.028 on SGX. If the price remain unchanged at the end of 5 years does it mean that I will make a profit on the capital as well or I will just get back the original principle sum that I invested? Thank you.1 comment0
2,"Hariz Arthur Maloy20 Feb 2019When held to maturity, you only get your principle sum. Nothing more, nothing less."
3,"Yong Kah HweeLevel 6. MasterAnswered on 28 Oct 2018'The interest rate of 2.70% per year for the T2023-S$ Temasek Bond, will be paid on or around 25 April and 25 October each year. If the payment date is not a business day*, payment will be made the following business day.' , https://www.temasek.com.sg/en/our-financials/temasek-bonds/temasek-financial-iv-bonds/tf4s1.html#faqs'Can I change the nominated bank account for DCS later?  Yes, you can change the nominated bank account for DCS.', http://www.sgs.gov.sg/~/media/bonds/Files/FAQs/SSB%20FAQs%20CDP.pdf0 comments0"
