,content
question,"Lifestyle Finance Savvy Asked by Jansen NgAsked on 12 May 2019In recognition of mothers day, what are some financial habits you picked up from your mom? 3 answersAnswerBump3"
0,Answers (3)Sort By Most UpvoteMost UpvoteMost Recent
1,"Clarence Chua, Financial Planning Specialist at Prudential Assurance SingaporeTop Contributor (Sep)Level 7. Grand MasterAnswered on 13 May 2019You never have to earn what you don’t spend!
Hahahah. (Translated from Chinese)Just some simple advice from my Mum when it comes to being frugal! 👍🏻0 comments3"
2,"Serene TohLevel 5. GeniusUpdated on 12 May 2019Mine is; don’t spend more than you are earning. Basically to pay credit card bills in full. Then save, save and save.My mum has no issues with us splurging occasionally, as long as we keep to the basic rule. If you want something you can’t afford, you save for it.0 comments0"
3,"Jansen Ng, Business Student at NtuLevel 4. ProdigyUpdated on 07 Jun 2019For me, its the mindset of frugality despite being okay-to-do. 
Like keeping coupons (haha not so much now), going for cheap deals, search for cheapest place to buy that item, 1-for-1 promotions, dont buy things i dont need:) These mindset helps me to cut down ny expenses:)2 comments0"
4,"Yu Ming Jin12 May 2019Being frugal in the right areas. My mum was from a village in Malaysia. Money was really tight then and her life experiences imbued the principle of frugality. However, she spared no expense on areas such as education, which he perceives it as the best investment one can have (she only has a secondary school education, which has limited her ability to gain better employment opportunities in the past).Jansen Ng12 May 2019Yeaa good point!"
