,content
question,Lifestyle Asked by AnonymousAsked on 26 Oct 2018What are some things I can do to help me save on my taxes?4 answersAnswerBump0
0,Answers (4)Sort By Most UpvoteMost UpvoteMost Recent
1,"Kenneth Lou, Co-founder at SeedlyLevel 8. WizardAnswered on 26 Oct 2018Hey friend! Here are some legal ways you can take to save on your taxable income!You are rewarded if you have kids, stay with your parents or serve the country (NS)You are also rewarded if you donate to approved charities by the governmentLastly, and most interestingly you are rewarded if you top up your CPF account (i.e so that you plan for the future for retirement)This CPF category also includes the amount that you are forced to contribute monthly (i.e for Citizens and PRs) which should be around 20% of your monthly gross salaryYou can read the full list here: https://blog.seedly.sg/guide-income-tax-singapore/0 comments2"
2,"Good Day Every DayLevel 6. MasterAnswered on 31 Oct 2018Top up your Special account with cash
Top up your Medisave account voluntarily with cash
Top up your parents Retirement account with cash 
Top up your SRS account 0 comments0"
3,"Jeff Yeo,   amateur Social contributor  at School of social sharingLevel 6. MasterAnswered on 31 Oct 2018Open an SRS account Top up to a max of 15,300 this will offset your tax dollar for dollar use the money to get an investment or insurance 0 comments0"
4,"Nicholes Wong, Diploma in Business Management at Nanyang PolytechnicLevel 6. MasterUpdated on 26 Oct 2018You can check out IRAS website. You can also use their relief calculators. There are a lot of tax reliefs that you can consider.https://www.iras.gov.sg/irashome/Individuals/Locals/Working-Out-Your-Taxes/Deductions-for-Individuals--Reliefs--Expenses--Donations-/0 comments0"
