,content
question,"Policies CPF Savings Asked by Raimi JasmanAsked on 21 Oct 2018Is it enough to survive with a salary of $2K before CPF deduction, take home is about $1.5K, if it’s enough, please share more on tips of surviving and saving?5 answersAnswerBump2"
0,Answers (5)Sort By Most UpvoteMost UpvoteMost Recent
1,"Hariz Arthur Maloy, Independent Financial Advisor at Promiseland IndependentTop Contributor (Sep)Level 9. God of WisdomAnswered on 21 Oct 2018If you're single it's possible. Is it ideal, honestly no.I'd focus on trying to make more money either through part time work or side gigs.It's harder to cut $1k expenses to $800 than it is to add $200 of income. 0 comments3"
2,"Axel ChongLevel 2. RookieAnswered on 23 Oct 2018You mentioned “survive” & so to your question, it is a definite yes. Whether single or married with a child or 2, it is technically still possible. Personally, I will never want to start a family (at least not in Singapore).0 comments1"
3,"Elsa GohLevel 5. GeniusAnswered on 21 Oct 2018Assuming you're single and no family, only possible if u share a rental flat with a few others. Then save whatever income u can with a view to investing in the future.0 comments1"
4,"Kenneth Lou, Co-founder at SeedlyLevel 8. WizardAnswered on 21 Oct 2018I think it could be a stretch. Also depends if you are single or have a family... And if you are servicing any home loans, which could make this even more of a stretch.Find ways to upgrade yourself via the Skillsfuture program and other certifications to level up your biggest source of income - your salary. All the best man :)If you are keen to save more and survive at the same time, you can follow some of these amazing tips by your fellow community members here: https://seedly.sg/questions/what-are-some-easy-money-hacks-that-a-20-30-year-old-can-do-to-save-and-make-money0 comments1"
5,"Daniel LingLevel 4. ProdigyAnswered on 22 Oct 2018The brutal truth is yes.So the question you should be asking yourself is how to imrpvoe your circumstances.The tips and tricks have been talked to the ground and stomped over and over.Increase direct income.
Increase passive income.
Reduce expenses.To be even more brutal.
More + less -.0 comments0"
