,content
question,Property Asked by AnonymousAsked on 31 Mar 2019Can I rent out my entire EC after MOP? Do I need HDB permission to do so?2 answersAnswerBump0
0,Answers (2)Sort By Most UpvoteMost UpvoteMost Recent
1,"Hariz Arthur Maloy, Independent Financial Advisor at Promiseland IndependentTop Contributor (Sep)Level 9. God of WisdomUpdated on 07 Jun 2019Yes you can and no I don't think you need to ask permission. But you can call in HDB for a quick check.1 comment3"
2,Question Poster11 Apr 2019Thanks! HDB replied similarly.
3,"Zen Rogue XuanLevel 5. GeniusAnswered on 03 Apr 2019Yes you can.1) Go to HDB's website to apply for HDB's approval before you rent out your flat. Application fee will be $202) Source for tenants on Gumtree/Facebook for the DIY route, or go through a property agent3)Secure your tenants and sign the tenancy agreement contract4) Register your tenants with HDBRead more about the procedure her: https://www.hdb.gov.sg/cs/infoweb/residential/renting-out-a-flat-room/renting-out-your-flat/apply-for-approval0 comments0"
