,content
question,"Travel Travel Insurance Insurance Asked by AnonymousAsked on 14 Mar 2019Are there any travel insurance that caters for a 8 to 9 months internship?Hi there! If i were to go overseas internship for 8-9 months, are there any travel insurances that cater to this period? All insurance companies i have seen only allow maximum 180-183 days :/2 answersAnswerBump0"
0,Answers (2)Sort By Most UpvoteMost UpvoteMost Recent
1,"DeleteEditKenneth Lou, Co-founder at SeedlyLevel 8. WizardAnswered on 02 Jul 2019Hey there!
Yup we've actually written about this before as well. :)Where we highlight the benefits to consider when choosing an Insurance plan For Overseas Exchange! On top of what your school already offers.You can find the full article here: https://blog.seedly.sg/student-exchange-insurance-plan/0 comments0"
2,"Brandan Chen, Financial Planner at Manulife SingaporeLevel 6. MasterAnswered on 02 Jul 2019May I know if the internship is part of your university curriculum? If yes, You can look into MSIG Global Study!If you would like to find out more, feel free to drop me a fb message  https://www.facebook.com/brandan.chen0 comments0"
